{
  "schema_version": "1.0.0",
  "exception_id": "exception:legacy-order-adapter-001",
  "rule_id": "ARCH-BOUNDARY-001",
  "rule_version": 1,
  "status": "active",
  "scope": {
    "repository": "legacy_order_service",
    "paths": ["src/application/legacy-order-adapter.ts"],
    "components": ["legacy-order-adapter"]
  },
  "reason": "Temporary compatibility seam while the application-owned port is introduced.",
  "owner": "legacy_modernization_team",
  "approved_by": {
    "kind": "human",
    "id": "gustavo",
    "runtime": "manual"
  },
  "created_at": "2026-08-13T18:00:00Z",
  "expires_at": "2026-09-13T18:00:00Z",
  "review_at": "2026-08-27T18:00:00Z",
  "evidence_ids": ["evidence:legacy-migration-plan-001"]
}
